male	@RLewisReports I'm so glad I never got into LOL and only have to deal with NIP magic in CS
male	@SoraToHoshi @OfficialAQWWiki Seems like a waste having two staffs in the shop then... O_o
female	Shannon better hop the fuck up out those feelings.
female	Pepsi + videomarketing + back to the future https://t.co/dRvaMcso7t #videomarketing #pepsi #uber #video #derooymedia #backtothefuture
male	I'm so tired of the color vampire that sucks all the intensity out of modern music videos.  Feels like everything was shot inside a freezer.
female	Super Duper excited to FINALLY see the DWTS Live Tour this winter! Get your tickets here: https://t.co/ok4n6YxtTi  _ https://t.co/Fx8VgsUZJk
female	@taytrunz THEY WANT TO MAKE MY LIFE WORSE AND THEY LOVE THAT ILL ALWAYS COME BACK FOR MORE
female	35 hunned for the coat
male	Tom Brady gives zero you know whats about a Twitter avi because he's just going to kick your ass on Sunday and that's really it.
male	Im so poor i have to watch Life Is Strange being played by @Rubiu5 and i will admit it is fucking worth it https://t.co/ilZ6DUk2Ag
male	It's not even that cold and I am already hating this weather
male	@LallaBae Hello there and also thanks for following me and welcome.:-)
female	My Man Crush Monday and everyday goes to this dweeb @chartwell_kerr. I love him so much. #mcm #cute_ https://t.co/QX1NQHHSot
male	@sweet_kupkakke yes ma'am. The designer is my business partner @MirLagerfield we have a whole line launching soon
male	I'm the same nigga from the BOTTOM headed to the TOP_____
female	I will say this.  Thackery is the first of my characters to have sex. https://t.co/ybPuJuV7V8
female	And thennnn I'm getting fun stuff done to my hair #newhairnewme
male	I liked a @YouTube video from @officialgrizzey https://t.co/GCtryloSAI "MARTIN THE TROLLER"- Call of Duty Zombies "Asgard" Custom Map
male	#Halloween post: my humble attempt at a traditional haunted house tale: "The Old Palazzo" https://t.co/no6gIebmhE #GhostStories
male	@What_Tee They couldn't beat me smoked and monstrous and then me lou + 1.
male	@stevegood5 divorce statistics are so high and marriages don't last its cuz d bags say a ring don't plug a hole and shit like that #dirtbags
female	My dreams of artistry , Are gonna be bigger than my height and I only stand 4'9 ____
male	#SocialMedia is not just #selfies and #memes it's also serious #crime fighting. #WhatsYourSuperPower?  https://t.co/l2hCWPAIy8
female	@emmmaarclaairee LIVE debate on BBC parliament channel now... Let's hope the old fuddy Duddy men stop being so sexist and back reform
female	Everyone take a min and vote for my gorgeous @em_knott __ https://t.co/4oggbDU8xK
female	Squad goals. (Sidney, Stella and Raf) https://t.co/4F511y6z9B
male	Forex VSD System For Day Trading On M15 And H1 Timeframes! https://t.co/QLODm7gQxd #forex https://t.co/bcnOMFQwI3
male	Corporate welfare is the worst. Dark funds for the Military industrial complex is another.   All these posts with... https://t.co/awmdynzFxZ
female	Energy is well and truly gone. Exhausted and, if I'm honest, a bit flat. Time for hot choc, PJs and musicals _____
male	Forex Profit Predictor By Derek Frey And John Rawlins-520% Return in 3 Months! https://t.co/sU28AUk8xS #forex
female	@karlaaa_xo and then you just drowned in the spray _
male	Daily Mail Eat your greens! Why eating fruit and vegetables in youth protects your heart ... Daily Mail People who_ https://t.co/Cw26pnUTds
female	@boeszter  Every characters die immediately in the previous season no suspense Hershel Shane Lori Beth I think Glenn still alive
female	Luckily my car's damages from my accident the other night are going to be covered fully + I'll get a rental in the interim!!
female	@Onboardly Can you reference that post on my site and me by name instead of Business2Community. Here's the link: https://t.co/IXygFSuw6F
female	Im there for you all the time but where are you when I need you the most
male	@bdean1981 @tsnmike He was acting out yesterday in his role as an athlete. Wearing a uniform and everything.
male	Insinuating that I'm pushing Tim away when I've spent too many years being naive and trying when I can read the writing on the wall.
female	The day before the appointment to get my car inspected I get pulled over bc my car is out of inspection. #mondayblues
male	@MassimoFaggioli @antoniospadaro @JamesMartinSJ @ThomasReeseSJ Sad and pathetic propaganda - and you're going to lose. #janus #heresy
male	@bluenoseeast @daveangel1972 can you 'get the band together' @bluenoseeast? Starting from Longlevens would be better for distance and safety
female	I showed my mum Tyler's video and went "ISMT he such a queen?" And she went "no" idk how she couldn't tho___ե https://t.co/U5L6tPfoZJ
female	*and v stressed  https://t.co/b8nAz1EYov
female	Thank you @Refinery29 and @Neutrogena for this fun collaboration. #BeautifulBecause https://t.co/INrIWZXEzS
female	Getting stupidly baked and still rocking a presentation #yiss
female	Lunar mana-the polished renewable mastery remedial of realm power: wkYoE
female	I Don't want to talk about her, him or them. Just want to have the right people in my corner and_ https://t.co/nXEdN30AUb
female	So sorry, me and @VivaLaVixa don't need negative people in our life __ُ____ _٪_٪
male	had a conversation with my cuzzo over some good dope , talkin bout he we gon take over the world and shit _ԏ_ُ__΍ https://t.co/lbAdYBsMlT
female	ok but how do i bring up this girl's obvious ill-intent without being labeled crazy and paranoid
female	Happy birthday to one of my inspirations and the only guy I can't muster a full sentence around... Hope you've had a good day @albinokid
male	Come and Learn about the Prophet of Islam (PBUH) - Star Local Media https://t.co/oU5wF63Gay
female	at a kid's party and we were the ones getting fun out of the balloons. we can never take any_ https://t.co/0mtdf9CmGr
male	GuyKawasaki : The Art of the Start 2.0 - Pitch at SAP 10/27  RSVP https://t.co/QWajohkdzT_ https://t.co/UFes06LQJi) https://t.co/esjKNsmhjU
female	Waiting on it until the 5th __ https://t.co/77IAhulAF4
male	How we can blame @AnushkaSharma she is just #IndianCricketTeam fan like me or like thousands other. I support her and @imVkohli
male	@Taylor_505 @YishaiFleisher also, would you disenfranchise Jewish non-Zionists too? Where do you draw the line of permissible opinion?
female	Can everyone tell that I'm listening to old music and missing Randy? Good.
female	@_CallHerSherry yo truss me I have the weirdest feeling in my belly lawd _
female	@maceface_13 jealousy is an ugly trait I've learned.. Look at her and look at me _
male	Congressional leaders and White House closing in on a budget deal - Washington Post https://t.co/L0AF7EbUG0
male	@Girls_Pee are not you could? Come on Im so hot and i ll help you to get horny
female	"she still sits at the bottom of the ocean drowning in his words refusing to come up until the tide brings him home."
female	My prayer goes to those affected by the earthquake. Massive loses and grief. May God help then all. __
female	@TrynaGetDaKEY I actually got them from Kmart and Ross!!! I was shocked!
male	First glen dies and now this? I need some Taco Bell
female	What is the policy context which makes it seem that the anti-IS rhetoric is not matched by actions? #FALive
male	@ByeCorn African Black soap at night and Spectro in the mornings.
female	Okay I admit defeat. Where's the takeaway menu.
male	I'm vegan:) but I can vouch for the restaurant and pre vegan love for the burger! https://t.co/Tqc0omp5i4
male	@AiringNins @KOSDFF Thats not weird at all. You just have a preference. You prefer the campaign over the MP. Nothing wrong with that.
female	@SMEAllianceLtd Isn't that the pension scheme that has both employers &amp; employees paying into the Treasury?Why do I remember superannuation?
female	sick and tired of people treating me like they are better then me.
male	But I haven't played metal gear solid since the demo joint on the original gray PlayStation cuz I hated it
female	Me and skyy over here watching Halloween bout scared asf ___
female	That is exactly what this ignorant ass boy just said on the bus, like please take several seats. That girl probably doesn't know you exist.
female	Mrs thornhill is my friend on sc and she def just talked to me about me smoking weed __
female	@juicetruck does this mean sitting is off the hook? ;)
female	If u dont receive the ffs you already have them________
female	#MCM and the squad in honor of seeing my love this week__ https://t.co/IC1lS1ZjpH
female	Put away for the plain style in order to the greenpoison: afnxWKG
female	seriously though Heartbreaks and Earthquakes is the best mixtape ever existing.
male	I can't hold back i gotta live life...go and get everything that i desire
male	Christian Wood isn't the issue. Though the soon to be three years and 10s of millions of unused cap space are. https://t.co/8mS0fic72e
male	@Parkin25Marie I went first in 1971 and have been regularly since and I still don't think I'll ever see all it has to offer.
female	@WhalenDerek @JamesWFreeman_ @blakej7 Blake and Jim y'all are my people. Derek you're on probation.
female	i made a skit in 10 minutes and edited in 20 should i be scared or impressed
male	Do you like the new face filters on snapchat
female	I Just Voted for @onedirection for #ArtistOfTheYear Go Here https://t.co/fp6H83kD1d and Vote for your favorite!  #AMAs #OneDirection
female	H8 using a public bathroom when the person next to u gets shy &amp; sits in silence. Like I'm sorry 4 ruining your shit. Better luck next time.
female	Wearing baggy sweatshirt, sweatpants, no makeup and hair in a messy bun. Happy idgaf day everyone!!!! __ @salicerose #idgaf
female	There is a difference between being civil to someone you don't like and being fake. Find the line.
male	Oh lordy no.  What's going on with the world... https://t.co/Ue4yIwBDkH
female	How To Blog Less And Reach Further  https://t.co/hpo2vg4npk #blogtoprofit https://t.co/Jsee7Parra
female	If you use social media for business and pleasure, divide your time so you stay on track with your business goals.
male	Chamber of Reflections is a good and relatable song that means a lot to me
male	Reimagining the #webdesign process by @InVisionApp - https://t.co/Vmb0OZU67e https://t.co/hFlWR8tfOl
male	watching the office I thought I was more of a Jim but I just found out I'm Kevin https://t.co/xA50ctDcMn
male	Last week, I spent the fat end of 3 hours building the Avengers Tower out of LEGO... 5 minutes of Joe's pal being round = Tower fucked.
female	Stats for the day have arrived. 1 new follower and NO unfollowers :) via https://t.co/bn7vGDuUEn.
female	IT'S BEEN 15 LONG YEARS AND I CAN STILL HEAR HER VOICE  https://t.co/d9J34pmlpp #Marriage #Vows #Cheating #Caught https://t.co/SvPuyQdr4x
female	Love both of these actresses very much and love the friendship they have even more_____ https://t.co/VbWo0CcSP5
female	And I thought the blue was bad. L O L
male	Think Tori needs to lose the production &amp; go back acoustic shes too talented to have all that noise drowning her out... Just my opinion...
female	Strategies on account of creating high flushed with success boutique coemption sensory experience in favor of visually damaged and: GUBmBl
male	@GameStop I ordered Fallout 4 and need to change my address but purchased as guest. Can I work with you to change the address?
female	EVERYDAYILOVEYOU Forevermore  and what makes it last  #PushAwardsLizQuens
female	"Always remember that love is not like a tap of water. You can't open it anytime you want and get the temperature you were looking for"
male	@timrobson07 so 3 games in what do you make of our German normal one, lost a 10 and found a pound with the striker crisis
female	I miss the days where I used to just smoke and mind my own business
female	I went to the mall to look for a coat and before I knew it, I was walking out with 3 new pairs of shoes. #idkhowthathappened
male	Review: Are Marijuana Tours in Colorado worth your time and money? https://t.co/jjNtZOaGAU  via @3tags_org #PJNET
female	Hey if anyone is interested in getting community service hours and wants to volunteer at a concession stand at the FL/GA game let me know!!_٪
male	@lizziecaakes yeah ill send you the flier when i do it today:)  costume party
male	@KellyFury Of course. Only thing is we are touring the UK right now
female	Right ok I need help. Vote for what you think. I'm crap at art and thought it would be better anonymous. Comments__ُ_
male	Dwayne Wade has proved himself time and time again.... Never count that man out
male	Put two and two together drake is luau dancing in that new video...  Or kind of... Only possible thing that makes sense.
female	My second favorite part of waiting on my adolescent is watching all the other adolescents come out of the school. While I sit and guess what
female	The search for happiness is one of the chief sources of unhappiness.  ~Eric Hoffer, The Passionate State of Mind, 1954
female	HAPPY BIRTHDAY B_ love and miss you tons!!! hope college is treating you well_ https://t.co/AVv1w7xwSG
female	I'm want to #win a lovely Sensory Miffy with @minnowmep with Tiny Pop TV #children #giveaway #competition https://t.co/7nexyhVZqG
female	I guess honesty, truth, and making up for what I did wrong makes me a bad person. _٪
male	My Z3 found, eating too much and feeling full, having food delivered to my house, learning something new, finding old memories #5things
male	The Denegris pt. 2 lol https://t.co/MNYNcySxnN
male	When your mom takes your car, fucks up your plans, and wastes all the gas. Thanks
male	Hot dogs, bacon and other processed meats cause cancer, World Health... https://t.co/WfIhMijS8X
female	@basicallysonam bitch dont read my tweets and scroll
female	Brennan and @SomewhatSurreal Look alike https://t.co/nJikzobRFQ
female	I loooovvvve being home alone just me and Angelina __
male	@BluebellBw @fehowarth If we have nasty experiences we tend to a) find a scapegoat and/or b) forget that experience....
male	Enter to win  San Andreas from @CGMagonline and @WBHomeEnt. https://t.co/eImbQ4JJnT
female	@firmeprincess Idk man, my kids are gunna know that problems are never problems and there's always solutions, because there is..
male	Lilo and Stitch Bottle Cap Images  by CapersBottleCaps https://t.co/NkgcbDcLkr via @Etsy #etsy #digital #circles #craftysellers #stitch
female	I think luke's beard and now be called a beard and not bumfluff or scruff
male	@beenthebest1 Thanks for the advice :)
female	Also when tf will I get my thumb outta my ass and film a video? cowdamnit it ain't that hard
male	Gotham : deepcorruption FOXTV Are you ready to feel the heat? #Gotham https://t.co/mh1x1IXDa2 https://t.co/Vfd3QZGe9z
male	#WhiteGenocide is the idea that diversity will lead to no more white people in the future because it will all be mixed in right?
male	to tell you the truth that is an awful lie. on number 5 at Copper Creek Golf Course in Farmington_ https://t.co/H1qtHkvui9
female	The first research anything I ever worked on, as an undergrad. Amazing.
male	Omg the Snow White @lushcosmetics bath bomb looks and smells amazing ngl
female	GO WATCH @MANNNTV_ 'S NEW VIDEO HERE --&gt; https://t.co/DTnCngmL6B GUVE IT A LIKE AND SUBSCRIBE IF YOU'RE NOT ALREADY __ժ_
male	Roy Hargrove - "Let the music speak for itself."#jazz #quote
male	@Mattkerley3 I wanna move there and I want someone with European expertise like you. Don't wanna end up in Taken 4 ja know.
female	But Chris nobody thought u and nia were ever together even with royalty being conceived ______
female	It's a beautiful thing to be beautiful, not just in the way you look or what you say but rather in who you really are.  Blessings.
male	@PeeWeeMFC75 @AFCFYLDE there won't be 500 in the ground
male	@libbyswan_ i am ready, play the music
male	@DrunkAtdisney @MichaelSheehyJr @derekburgan well the better a park does, the more it can build/offer, presumably.
male	Audrey Hepburn, Frank Sinatra, Mia Farrow, and David Niven Have All Lived in This Holmby Hills Mansion https://t.co/vSWZCbzUHT
female	Ireallywant my havva and/ orlauren follow :(
male	The Impudence of Rabiu Kwakwanso and his Fulani brothers - by FFK: Written by Femi Fani-Kayode...Read below..I... https://t.co/5oMTVhgHRi
female	Yall check out @No_Cut_Card in his acting debut.... Next Friday: The Remake https://t.co/RQprorM4yZ
male	For the second time in the set, Rosol is 30-0 on Nadal's serve. Will it happen?
female	I'm still getting through #PrettyLittleLiars and I never want it to end
male	Shid I remember them days of under paid and over slaved now it's adding up
female	Exactly 185 days until the Boardwalk sleepovers! DISNEY PARTIES OMFG.
female	EVERYDAYILOVEYOU Forevermore  and what makes it last  #PushAwardsLizQuens
male	I honestly think getting a Bachelors is such a waste of time and money, just wish I could jump straight to my PH.D
male	Captain Beefheart  Rollin' And Tumblin' (live 1968)   https://t.co/FpiBhckGCI
female	Daniel Craig suits up well in a suave black tuxedo as he arrives with Bond girls Monica Bellucci and L̩a Seydo... https://t.co/fwibidVvbY
male	You can come with , I'll teach u the bars and we'll have a great time
female	I got hair to do most of the week _
female	___ this man makes my love for the game _ُ soooooo REAL!  https://t.co/yw5LKXCq8x
male	@tomgara No, it's advocating sanctions on a country for violating int'l law: done all the time,just like anti-apartheid activists did for SA
female	Check out Girls 18-24 Months Bundle Tshirts And Leggings  https://t.co/amFtbstAgD @eBay #bundle #holiday #baby #girls
female	@DairyQueen @DietCoke #ImAFan Of fulfilling my bucket list and having the time of my life.  #Sweeps
male	Homework Helpers : Chemistry by Greg Curran and Curran (E-book) https://t.co/ciHaesM5Ry https://t.co/uVTpV2xO3e
female	When u find out ur advisor put u in all the wrong classes this semester so ur a year behind _٪
male	OneNote Class Notebook and Office Mix announce new LMS integration features @MSAUedu https://t.co/AoBVimsWHU #mieexpert
male	I'll say theres a lot of situations where context really matters and its ignored. Blackface isn't one of those situations. Fuck context.
female	@Catherineamy5 @niamhsturdy well how rude. Go upstairs and get away from me then. K thnx bye
female	In the #lovestory, #AllfortheLoveofJosie, a knock at the door, changes Josie's life forever. https://t.co/g5Xf6wjriq https://t.co/g8vbj8MpDc
male	@leezasesteaga  aww don't feel sad,.its just some ppl are fucked up in the head&amp; fuck over the wrong ppl without noticing it
female	Im on my break &amp; the ups guy is here and my coworkers are seriously not opening the door until I'm done.. Lazy asses
male	the shits just not for me.
female	These 3 are good for my soul! So beautiful on the inside and out! _ե #leafingjonesbehind https://t.co/eZhnF7ux2M
male	Stacking the pots Jenga style, if they fall they don't get dried. #ZFG
female	@arcticIaheys it hurt but the guitar is ok so everything is good
male	Look what the republican presidential candidate D.T thinking about Africans https://t.co/GgJ3JbdE9H
female	@Dnastysack @Yung_Teejay I don't get the joke __٪
male	This girl from the A jus told me I remind her of young Dro naw I ain't lose my baby mama to a dyke ________
female	@NathanGrisdale the fact that I have a app for only you and your music ahah X
male	@aarondmiller2 @ActForIsrael  The 2nd Worst President of the Last Hundred Years! https://t.co/u7Z6PMbZQg
female	I wonder if me and @jesspay are still getting lit and carving punkins tonight __
female	we dont write their contracts we just support them with everything they do and hope theyre happy
female	female straight older brunette short (at least shorter than me) quite and personable  https://t.co/HxR06jmuHO
male	@OkraJones "never under estimate the power of a hand written note" #BOSCA15
female	Dr. Edwards has been talking about "systems thinking" and "intersectionality" for far more than 30 years.  https://t.co/xyfEdXw9zO
female	shawshank redemption is such a good film I am sO excited to see it at the theatre tomorrow
male	Met the guy in less than a month ago and he's already sending me links to choose a car "for us". Which way is the exit?
female	@Mets08123 @TheAMAs most definitely. Like these m&amp;g's and free shows and cheap tickets - aren't gonna last night with Kels. So happy for her
female	Always let the people who got to the bus stop before you get on first
male	if we ever have a problem my niggas pull up with the choppas
female	The Manobos of Mindanao by John M. Garvan https://t.co/UmEiApOX7H https://t.co/HcSoHcyO0Z
female	The Crook and the Cards: A StoryPoem https://t.co/eR0bpd2SKm https://t.co/PBo57W7GRb
female	cento e oitenta e sete* @onedirection Artist Of The Year #AMAs
male	The @BBC will go for views so will pick Fc United and Salford just because they already have a high profile.  https://t.co/FPoRudGVDN
male	Let's just say respect isn't enough of a word to describe what males and females should harbor for one another
female	@badgalmanik right, and the pieces of it are so big
female	I don't care how far out there I seem lmao the fact I'm living a beautiful dream and have the ability to look at the world with
male	@hrishikeshkk happy bday bro and God bless you
male	@ZWBennett @RossBatko is NORMAL. If you didn't have incidents between players and never had anyone getting upsetX your not winning games.
female	David Mansfield: "Evidence is low down in the discussion on drugs, where opinions are what shapes the policies." #FALive
male	wait no this is the last episode of futurama oh no
female	@Norie57 @HuffingtonPost yes, and he is running a clean campaign, on the issues? Your ludicrous. Brah:
female	Love and basketball is the best movie ever
female	Business and my own boss 365 days in a year what a difference it makes we all get the same 24hr what are you doing with yours?
female	The Impudence of Rabiu Kwakwanso and his Fulani brothers - by FFK: Written by Femi Fani-Kayode...Read below..I... https://t.co/ZfZUinwTgL
male	"UM apparently had the money to do it and will have the money to offer its next coach upwards of $4 million a season."
male	In a work meeting and my table neighbor is doodling. High school is always
female	What is the point of having a day off if you literally do nothing?
female	Go thumbs up @AdamWaithe most recent video because it's relatable af and almost on 7k  https://t.co/wwuTUNx82o
male	@eleijon "we can hear the guitar"
female	Dark empty train stations by myself creep me the fuck out _
female	@ArleneHittle Yes. I just signed up with them and they surprise me with these posts.
male	Nathan Baker should stop skipping leg day and he might not get injured so much!
female	Tester on CISA: "There is an inherent conflict between the right to privacy and national security."
female	Industrialist relative to the bride dresses that refreshful now copernican universe figures: lgev https://t.co/AxEDYyFvWF
male	Pedro saying he's finding it hard at Chelsea because the football is different from Barca's...Everyone knows Chelsea bus parking football
male	@mirandaa_rosee you fucking up its supposed to be on yo ass
male	I have this crazy ass headache. Don't think I'm gonna hit the gym tonight...
female	Buy the stuff I will https://t.co/tphHoaKuYv
female	Ripped tights and Doc Marten shoes is such a cool look on a girl.
male	What if China sent back fake VP and the real one is still in Beijing?
female	And she love it dog ya yaaaaaaaa
male	@DevilxPanther11 I'm gonna ask for the Christmas holidays
male	Why not own it presidential candidate's and stop pussyfooting around the truth We have to be accountable for all of our actions in this life
male	California King and I ain't talking bout a bed
female	Looking forward to tasting this little lot @jydpoho - thanks to @BuffaloTraceUK for the invite. Pics to follow. https://t.co/RdKY8SICEf
male	Stats for the day have arrived. 1 new unfollower. Stats via https://t.co/VuMDKp70A7.
female	Met one of my idols today @ the Savannah Film Festival and got an autograph :3 #lloydkaufman #SavannahFilmFestival https://t.co/o2CvJdGKdv
female	@Shania_Iranii ILY ___and thank you for setting me up with Jordan and nick
female	And yet another reason to go vegetarian!  #savethepiggies  https://t.co/EVZm2ToRbj
male	#MemoryMonday with the dudes @MODSUN and Kevin Scaff in 2007, and yes Im wearing my own band's tshirt https://t.co/1s1pmWgHMN
female	2 tweeps unfollowed (goodbye!) me in the past day. Thank you https://t.co/4PzBy8S9xN.
male	Fair play to Bray Wyatt &amp; Roman Reigns. Their feud was pointless and went on forever, but they put on a fine gimmick-filled battle at #HIAC.
female	there's this one homeless guy that I always stop and give money to but he's not there today and I am sad
male	@BrunoLangley hey bruno @SwainSeb and i would love to tell u to have a fab week
female	@jdbxcaniff the whole album is so good
female	@fsgossips  favorite words fitz and jemma
male	@Loveableloser13 hells yeah dude. Once it's all said and done I'll be hoping on some older @CallofDuty
male	We're all wondering the same about you though?
female	Opened the door to my dads house and my little sister ran towards me screaming Naya &amp; told me how much she missed me _
male	Many many thanks for all the Retweets &amp; Mentions today. Some people have more followers than me, but they don't have nicer followers than me
male	Soon you will find your confidence misplaced. The answers are greater than we can imagine. I know you.
male	@Bea4Palestine @MahmoudAlkurd Love how the guy up there is pulling the strings! :-))
male	I actually walk in the front  https://t.co/iPpK7jYbAM
female	@TreTre0 @vonebell ..GORGEOUS DRESS by my favorite designer. The one and only @jennypackham ! #KateMiddleton  https://t.co/AiZcRTkR1b
male	@rmayemsinger It would actually be kind nice of he occasionally appeared just to say "hi" without all the relationship drama @PierceBrosnan
