male	@RLewisReports I'm so glad I never got into LOL and only have to deal with NIP magic in CS
female	@ashleigh1796 and again
male	Ishmael II 5th Avengers Birthday Party Aiden and @jainedhoe giving the Hero his birthday present.._ https://t.co/Q0OcWuBN4p
male	#lt I'll laugh at all the facts then I'll feel like bum  Then I tell myself I was just smoking weed &amp; not crack and give myself a pat
male	@NorthJerseybrk this is just poor. All afternoon cops were trying to keep the photographers away from the kids but you had to sneak one in
female	My teacher noticed everyone looked tired and told us to nap for like 10 minutes _ #csusm
female	@AlphaOmega7 What sz are those DB Frees and price?
male	We the ones who kept it cool with all these niggas till them niggas started acting
female	These are the dumbest relationship goals ever  https://t.co/4S7ITcRbah
male	PBS video on the collaboration between Autism Speaks and Google Cloud Genomics: https://t.co/nkayqDvLO8 With views of our Crittenden campus.
male	MT @nytimesarts: The longest-running play in America is set to open in NYC for the 1st time https://t.co/65oIQVi9M8 https://t.co/6WIFY90anM
female	@chartnews @theweeknd overrated bitch, he need to move over and let Drake take his rightful before Adele come to slay these charts.
female	little did we know sena and i signed up for a freshman seminar on the world's fair and olympics taught by a married couple
male	While you're at it @comcast please stop the ivr system response that asks for a zip code and last 4 of account. They NEVER find the account
female	NEED a chili cheese burger and chili cheese fries
female	If you ever hear someone say "stop talking about shitting" they have diarrhea and are jealous of your form
male	Baroness Meacher defeats Osborne by 307-277 Baroness Holis defeats Osborne by 289-272 Be interesting how @skynews and @bbcnews spin this
female	@JamieCarr_live well I can't bc my job is lame and they don't have wifi here
female	@yetnaleci I dropped so many on the floor :/
female	Cutting mfs off left and right _Ή_ُ_
female	@paulwkennedy @BreakfastNews - humans have been eating meat since caveman days......and did you know, Vegans die too!!!
female	I really want a big hug and a long kiss from kris
male	@JenErin_ he's not dead . Yet, but we'll see, and trust me. Him and Rick have gotten out of way worse.
male	@itsbryleyy it all depends on the situation.
male	OH YEA I JUST REMEMBERED I HAVE TICKETMASTER CREDIT THAT EXPIRES ON THE 31st I CAN USE IT FOR TP TYBG
male	Someone pulled into the middle of our driveway(not to the side, straight middle) parked and walked away apparently. Umm...can we help you?_
male	Just fired up some 4k material from Netflix and even the lite Pud said "wow its like you're really there!"
male	@RuDumbBlad what would the world do without Lima?
male	@KyleStrobel @davebish @DZRishmawy try this, it's a look at justification texts in particular in light of OT wisdom  https://t.co/KwL9TvB9dq
male	@ClassyKatie69 IT TOOK ME AN HOUR AND A HALF! https://t.co/lEhboI9pbx
male	One bad hole and I would be tied for the lead. Let's get it tomorrow #ChasingTheGolf
male	I've been working out harder then before for the past week. Moving is going to be a breeze.
male	#Fitness guru, Kathy Kaehler, Live your healthiest and fittest life!  Listen: https://t.co/ts4L9pJs9B Best #TalkRadio
male	someone already mentioned it today but dec, march, july and sept crush trading down to lowest levels since apr/may. dec new low for move.
male	@MarsxPrincess @SupraLugia @twitter @supra @donaldglover he deleted em all like a year ago and never tweeted again
male	When the time is right... Lightning will strike... Sooner than later #Machine #LetsDoThis_ https://t.co/Gd2P7Wqrto
female	@cazthesarrie @TobySprocker @PatsyandEdds @ellaroguedogue @JessPals @HoneyTheStaffie yep, Sandy on mum's knee and me is zonked on da sofa!
female	ME AND I HAVENT EVEN WATCHED IT https://t.co/eHYEZ9T99p
female	My babygirl means the world to me__ٍ_ i will never hurt nor harm her in any way God put a blessing in my life and im not about to destroy it!
male	@Daltonwagner3 I'm talkin bout the factoring homework niggy
male	#Steelers CB Brandon Boykin ready to prove he was worth the trade from Philadelphia https://t.co/V3uShuheto https://t.co/YyPSJwSDuq
female	And I don't talk to nobody.
female	@say_ross good :) and yeah lots! we will catch up tomoz :) xxx
female	sometimes when i get fed up with life i imagine a happy little thought of running away to NYC and becoming a dog walker.
male	Name of the house we are staying in! @ Northumberland Coast https://t.co/BpehW7A7mL
male	@RogueSquadPod Google is skynet and Facebook is google's version of the T3000! In other words... We're all fucked.
female	@Wallyl4ever and alone...... That is what I think you mean, and I agree!
female	and know little bit more about semenyihh
male	Worried about the wrong stuff  https://t.co/UBijRxmU2L
female	@PopeBenedictXIV why this tolerance with homosexuals. Does the church denies ST Paul teachings and follows modern cardinals. Plz help us
female	I'm going to start selling custom painted cheesecakes so I can quit my job. And best of all, I'm not even kidding
male	What training do you do today?  Friends and a wonderful beach workout! @amaliaaracena @lar_ https://t.co/jcLziPoZep https://t.co/2o0oI4Fy6u
female	@MarkAcorns Wow, thanks Mark for the follow. Pleasure to connect with you and hope you enjoy my tweets.
female	@ChristianJerard I always do it class &amp; ppl are like what? And i'm like I wasn't talking to anyone leave me alone! Lol
female	I wonder if these words can reach across the distance and touch you in ways my hands never could.
female	Nothing is lost by admitting u were wrong the problem is no one wants to be wrong
male	@Adele you still need to write a song as sad, heartbreaking and tragic as Someone Like You though.
female	Wounds heal but scars remain the same well what about open bleeding wounds?
female	; oh apparently i was born in the last year of the millenials age
female	Idk maybe the overuse of products have women confused about their bodies
female	Adele is the only person on the planet that understands
female	Never used a dating app in my life and I never will. I prefer meeting people in person. Body language is everything
female	@jhaywardbenzal I was only out for an hour this afternoon and it was so lovely and late-Autumn early-Winter that I actually smiled :)
female	1 new follower in the last day and it is more than just stats, I use it for growing my account! Try it https://t.co/OqEvCUTLBD
female	someone be a good friend and come get food w/ me before I finish my homework _٪
female	I just tried to spell the word 'go' like 'goe'.
female	Sweetie and her pal like dominating a guy live chat #nude #sexygirls https://t.co/neKY7jrLTW
female	Last day of yoga and cross country.. Time flies.
female	When you ask a yes or no question and they answer with "ok"..._
female	@Tralexusss @IvyTreasures_ lmao hell yea man! I just be trying to sc and make memories and you don't be having it ______
female	@AlexCaxton  yimu and you are single @35
male	It's funny how police officers can ruin your lives and some of them have the same education as some people who work at McDonald's
female	Finally got my A into G and found THE dress for the @AmaraIBAs on Weds... I'm basically going to look like Christmas __Ϭ #IBA15
male	@tboylan89 All of the sudden you and Nicole were gone, and someone else was moving in. I hope you are doing well. Tell Nicole that we say Hi
female	#j13--Why is this such a hard decision when it is 2015 and our president is African-American? https://t.co/XGzurPdUzl
female	i had no idea i'd be this scared of 2 stuffed bears @onedirection Artist of the Year #AMAs  https://t.co/U7wpCIswJI
female	I only wanna see Bastille and Weezer tho I'm not sure if it's worth it _٪
female	"A REALIST MAPS OUT THE SCOPE OF THE PROBLEM, FORMULATES A PLAN AND GETS TO WORK. That means moving soil,... https://t.co/RNhgVCmlU3
female	When you're sick and your dog loves you bunches __ https://t.co/FzQ3AZfkpQ
male	leave my bitch alone b4 i hunt you down and kill u (not a sub) lol
male	WIN a pair of tickets for the @NewburyRacing and a #shopping voucher with @lu_christova #WinInStyle #horserace https://t.co/Fjm6byWGtq
male	So, I saw this KTLA news cast the other day and they interviewed this lady on the left. I was so_ https://t.co/mugnCGq2em
female	@destinationroms @Romsey33 Can someone share that poster in the Romsey Community Gp on FB?
male	Fail at Everything but still get elected. The GOP in a Nutshell https://t.co/M1bZS7SMS6
female	that was probably the hardest paper I've ever written though _ but I'm done and that's all that matters _٪_ُ_٪_ُ_٪_ُ__
male	Happy for this holliday im gonna give the best gift and pay my bills my creditors will happy and so will I https://t.co/5XsCj2n5DU
male	@RhymesWithRight @SicarioYogiB @PolitiBunny @jeffersonianguy Ok,my apologies.I'd bet the locals got them back,&amp;kasich had little to do w/ it
female	Quality FUBU THE COLLECTION Mens Shirt Side Vents Check Print 100% Cotton  XXXL https://t.co/VkdHTx1Li4 https://t.co/66guEYikS4
female	Welcome to the Cyndi Hardy Photography Family Jordan and Frank!!  We are excited for your wedding next November at Trilogy at Vistancia!!
male	When you're lifting heavy and you pull a neck nerve
male	Video: Grimes - Flesh without Blood/Life in the Vivid Dream https://t.co/TCHgST0JBo
male	@kbonimtetezi mheshimiwa travellers along that stretch of the road (lubao) r hurting and nobody seems to be raising this issue!
male	@Bayweeee_ yes! With a balsamic glaze over it and it's really good
male	Us and them. https://t.co/Rqd59KLUeH
male	For you Studio 1 heads practically the entire LP discography is being released digitally this Friday #protip
male	@doc_gnome The feelings mutual of course _
male	@SChulufas @TheWoodman2 @YMcglaun evolution was discovered before DNA was discovered. The inheritance through DNA just adds to the evidence.
female	When you go to the mall alone __
male	Employees are doing more on their mobile devices and less on their PCs. The recent... https://t.co/0mT9kbF7hF https://t.co/BxtaLv2AUo
female	.@VinylMePlease weekend vinyl finds!! fleetwood mac- rumors and some eclectic 45 singles (the 4 seasons, ABBA, etc) https://t.co/qL4lQpA47z
male	So, what does the first 3 maps depict then? A Jewish state? And Arab state? A mandate? @Saleena_1 @jvplive
female	Has anyone noticed how the government is trying to cut the tax credits before the new "minimum wage" is introduced, haha thanks guys
male	@listomaniac77 I dodge the blast and apologize for collateral damage __
female	So close to saying fuck school and becoming a stripper SO CLOSE
female	My favorite picture of the birthday boy! !! #ej5thbirthday__ https://t.co/DFLNlGtsgn
female	Where the hell did October go? Halloween is already this weekend. _
male	Looking forward to seeing the new bond film tonight __ #excited #SPECTRE  #007
female	@sexygodDamon Hw many times has Stefan treated u like shit as opposed to that one time that Enzo said that statement as a result of the fact
male	@Sasha02997 @Jordan_p34 It's rare to see someone miss the point SO many times
male	Quotle Is Instagram And OneShot For Book Quotes   https://t.co/v1AKplXdfL
female	@rona65 @RadGentleman the world would be a better place if they did that instead.  True story!  ___
female	@onedirection Artist Of The Year# AMAs   #voteonedirection _______________  #AMAs #OneDirection
female	If you are in a debate with someone and they just say your wrong but can't explain why.....BRUH they're not trying to do anything
female	Sallie Moya invented the internet? just so he had a place to store his porn.
male	Just been informed I have a new follower! WARNING!!! What you read May cause your life to never be the same! Follow at own Risk!!! Welcome!!
female	I want to win a set of Thomas &amp; Friends #pottytraining books from @egmontuk and @nobodysaidblog. Enter to win here https://t.co/tbOITPMxlj
male	@Mar1a_Horan @MusomasFBI2015 and dont make a temporary solution to a permanent problem
male	@hale15smith Congrats on the Stats!  Great effort!  Glad to see you back as Libero.  GEAUX, HALEY, GEAUX!
female	I walked in and all the old workers got hype lol
male	Now if you didn't post a price and just asked for the best offer that's a different story.  The seller should hold all the cards, man.
male	@Alex_Bertie butterflies are the spawn of the devil
female	I naturally have a smart mouth. and I can't help the smart sarcastic ass shit I say.
male	@Tim_Muma @RamieIsTweeting people are choosing to eliminate the 1 season with the largest sample size. Also, Jordan comment was sarcasm
male	Govt hospitals to now be able to give BPL patients Rs 5L aid: Hospitals under the central government will now ... https://t.co/gKdGLHNMQb
female	*cries on the inside like a winner*
male	I'm gonna spite you &amp; not raise celebrations but remind you of that night when we were tired and zoning out :") @KhanyiGee cc @owamzee_
female	i still need a little less than a page to finish my rhetorical analysis and I know that the rest of it is just gonna be useless nonsense.
male	They should, in fact, be locked up &amp; the key thrown away. https://t.co/gABL7oovIt
male	@CourtErinn I aplogized fir saying the "r" word on twitter and in life
male	Styles for any occasion, any time of the year #FashionPro https://t.co/hGmaSdCNH9
male	I gained 7 followers in the last day. You? Know your stats and grow with https://t.co/HtIJeavgxM
female	@iam_melmash lol also there's phutu and milk ____
female	how the fuck is it offending to say that my mom turned gay with the age of 30 after giving birth to two children and a failed marriage
female	I've been here for 40 minutes and have yet to see the dr.
female	SORRY TKU 4 the RTs! @Monica_Most @carmenthespy @jlumo @WindsorDw @SavetheDolphin1 @ADVAITA777 WILD ORCAS https://t.co/Ry5vuYxWO5 ~@Orcazine
female	I hate not living next to and down the hill from my 2 best friends __
male	I heard the Feds listening, watching and looking. #ThatsFr
male	Mangino out as Iowa State's offensive coordinator (Yahoo Sports): On Monday morning, Iowa State coach Paul Rhoads and offensive coord...
female	EVERYDAYDAYILOVEYOU Forevermore Weep with the heroine۪s desperation.  #PushAwardsLizQuens
male	@metjeffuk you could be right, most forecasters said it would be cold this week and look how wrong the've been!
male	Dem can't talk the talk like me
female	S/o to LIVINGSTON ISD for fucking up my scholarship from Lamar by NOT sending my damn transcript and not entering the right info !!
male	Carol fucked up the base
male	@b_skrillzzz  counting the 10 fingers
female	Hey I Just voted for @onedirection for #ArtistOfTheYear Go Here https://t.co/g7keeRq593 and vote for your favorite!  #AMAs #OneDirection
male	Really interesting survey/study on #curiosity and how employees view their industry: https://t.co/yy1dUPOESB @HarvardBiz #innovation
female	@alphy_alphine Moose Jaw is one of the cheaper cities. I'm living in Regina and it's 1500 a month plus utilities. And it's in the new area!
female	______  "@SoVeryBritish: "I'm not quite sure I follow" - Translation: The bloody hell are you on about?"
male	Do you know who are awesome? My 23 new followers in the last day! Growing with https://t.co/hubgfvDOTR
female	Idk why people find it soo hard to pronounce my name.. The right way _٪
male	I be off the drugs, don't I
male	If you commit to daily meditation practice, you will find that going within becomes natural and effortless. #inspiration
male	@MarkHaynes and Univerde season 3?
female	Win a copy of Life and Death: Twilight Reimagined by Stephenie Meyer #Twilight10 via @booksatruestory https://t.co/943fTUZo98
male	Then makes the same video on his main channel promoting it and not uploading it to his main. Cause thats not annoying. Glad I dont have him.
female	@S_Russell17  Best wishes and prayers for a speedy recovery. God bless you!
male	Saudi prince arrested in largest drug bust in the history of Beirut۪s airport https://t.co/gCw4rgf8Ha
female	I can't believe 3 places called me in one day and set up 3 interviews tomorrow.
male	The Houdini 10K next month in Appleton is at capacity: https://t.co/6IRBR3t4rE
female	The long &amp; the short of a black dress. https://t.co/0tzIV3AyF8  #black #dress #lbd #evening #outfit #gown #maxi #ootd...
male	@Samd96 there ya go! I say we gather the crew and go during winter break when it's all Christmased out
female	Your Travel Guide to Barcelona, the City of Dreams https://t.co/u1Y2yXvNJH via @TheBeautyofTrav
female	Would love it if some Boomers took a look at my new website: https://t.co/oqoQjNdxom and gave me feedback...I'm still tweaking...thanks!
female	Notice how embarassed @daddydonal is for EmerO'Toole and her 'SHUT UP' comment as he includes no link to her rudeness.
male	A lot of people have been doubting the #Grum for a long, long time. I hope they keep doubting us.
female	@emily_ray99 thank you em and I have!
female	Both parents brown and I ended up blue #yesimbored https://t.co/W2FFIPL7ya
male	@EWErickson @DavidCornDC not true at all. We are a bible based religion and you didn't find that in the #bible
female	The level of wack cornballness @NySlimPromotion ____
female	1 tweep followed me in the past day. Feels great! Do you also want to feel awesome? Check out https://t.co/qpXTR1gDLk
female	Shopping &amp; food be the only things to brighten my mood
female	"Innovation is the only way out of economic stagnation۝
male	Hot of the presses! https://t.co/fZK5fjSWEJ
male	@TweetsByCollin I have a step-cousin-or-other in Italy right now. The FB posts are garbage. What should I do?
male	@AdonisSuperman @KrusherKovalev I THOUGHT THE CHAMP TAKES ON ALL COMPETITION!!!  ( unless you're scared).
male	Multi Grammy Winning Artist and WETV Star Tina Campbell's "An Evening with Tina Campbel... https://t.co/5UXCoghO6D https://t.co/Ii9yQDJnwo
male	What did the chicken say when he crossed the road? HELLO FROM THE OTHER SIDEEEEEEE.
male	Got the beautiful empire playlist :)
female	And I continue to exhaust you.۝
female	BACK OFF ME AND BLESS YOU DOCTOR MRS. DOCTOR
female	Getting the freebies this week fab meal tonight. Drinks reception and food tomorrow afternoon for a charity I volunteer at.xx
male	@uzeekhanjee So the saying is true ... Every successful man has a LADY behind! we can surely see it today :)
female	@shonabennett wine and popcorn sound good to you?
male	I'm actually happy with that draw, that's what the FA cup is all about. #FACup #Salop #Gainsborough
male	The Mujtaba Daily is out! https://t.co/oVuyEaEZKX Stories via @AboutTrailers @TLoDigital84 @webmodi
female	I watched kalebs snapchat of juice in the toilet and actually thought that was the one I was drinking. But it wasn't and im okay now.
male	When theres no words and you just have to pull a face #music #doctorsorders   Hold tight_ https://t.co/BuxtVAZV2T
male	Lol zombie out?? Just show up to the game!!!! Let's get it!
male	WHERE DO YOU EVEN FIND THE TIME https://t.co/koC8aWcgff
male	Just posted a photo @ The Reading Room Books and Lounge https://t.co/vBYkMbSrSN
female	there are so many great perks to living alone because you get to do everything yourself and it feels accomplishing
female	The last part sounds like the falsetto in Fa La La why is he like this https://t.co/eiEKIdQcKm
male	@lhhaight13 and sour cream
female	Saying horrible things about somebody is not going to help the situation. This mother needs to grow up! #CustodyShowdown
female	@MsAnitaGanja Tickets for the NY show go on sale to the reg public the 30th ... it's on ticketmaster
male	@Jordyn_Aisling BEFORE YOU WERE HOT AND NOW YOUR NOT
female	The day is almost here! Meet me at  @tiasplacejc for a night of fashion, fun and shopping. Yours_ https://t.co/E5ctNEFK21
male	Babysitting the little bros is a bitter sweet situation. They're rowdy and super adorable at the same time. the fact that I love them helps.
female	Just watched Jensen Ackles performance of Simple Man at #chicon2015 on youtube and he did not dissappoint. His voice is amazing.
male	@Goggleblox   You certainly have some sparklers for the cocktails!
female	Please call me and ask me why your bill is $.84 more this month than it was last month. Please. I have nothing better to do.
male	If the World has fail to perfect itself then you should move by perfecting yourself.
female	That was love and it's an ache I still remember
female	Check Out The #HOTTEST Girls at _ https://t.co/LA4XWa72eW  #FOLLOW @DrR0X @Sexiest_Hotties https://t.co/sj9Xgaw318
male	All these lights and markings, each carrying a specific meaning _https://t.co/PgvbTkNT2f #aviation
female	They only seem to come and go, away https://t.co/bLORSnc0bp
male	@TheWong1017 ya they are pretty much the same style
male	@WhitlockJason love the new site  always ben a big fan  317 represent
male	Great day for the dedication of the Jim Moss Center for Nursing. This facility will be a significant asset for our community and region.
male	@Alkmin_i @wishdomwishdom welcome to the club..
female	@BrooksDslbrooks @BobbyShoobeey @donutsdebsdibs The old and actual, otherwise Cote would have still her job after a longer break.
male	@geoffdewitt moved it up cut the grass #primerealstate #voteGeoff #votechange https://t.co/IbofslxQga
female	I love the people I surround myself with
female	Busy on Tuesday? Be sure to join me at the #RBCFirstHome Twitter Chat @8:30pmET for home purchasing tips &amp; prizes! https://t.co/JMpNC43NQJ
female	In the old days they'd drop nitroglycerin in the wells to dupe investors..... https://t.co/yqKhmlx1gg
female	I am made for bigger things and will neva settle for anything less
female	Honestly 99% of couples are cute but there is one specific couple that are not cute at all. And then all the school couples, not cute. Eugh.
male	Reimagining the #webdesign process by @InVisionApp - https://t.co/Vmb0OZU67e https://t.co/hFlWR8tfOl
male	Build a Transforming Workbench, Desk, and Storage Unit: If you don۪t have a lot of space, you need to make creative use of what you h...
male	@yanipir just became Plat 4, go and give her your powah right now on YACC stream! https://t.co/uXTONyzutt
female	I had the worst dream last night and it has literally been haunting the shit out of me all day
male	How to Play the Need for Speed Reboot Five Days Early: After some time away, EA's Need for Speed franchise ret... https://t.co/LTZSn8TLD0
male	Not as well, if that's the standard.  https://t.co/s2kkiSn9Pi
female	Dow, S&amp;P 500 ends down with energy, Apple: NEW YORK (Reuters) - The Dow and the S&amp;P 500 edged lower on Monday after recent gains as e...
male	Well if the smoking and drinking don't do me in I guess the Bacon and hot dogs will get a shot https://t.co/SRggXjUXYk
female	omw home from practice and all I can think about is a big glass of ice water and a cold shower
female	Maybe you edit your skin  And if I did what's it do with you hahahaha https://t.co/cdC6KiQYEs
female	let's sit on a roof at 3am and talk about life
female	'everything gives you cancer!!! ugh might as well eat bacon' might as well take up smoking and throw a bitta asbestos in the ceilng too
male	@emcrit #ACEP15 DSI is really just procedural sedation with an intubation as the procedure. And we are really good at procedural sedation.
male	@TonyGrossi To your point about McCown being only guy in locker room. From Charlotte and the Panthers https://t.co/pKTBs8ufJM
male	and hope does not put us to shame becuz Gods love has been poured into our hearts through the Holy Spirit who has been given 2 us Romans 5:5
female	GLENN IS NOT DEAD OMG IM CRYING THAT WAS NICHOLAS'S BLOOD AND HOLY MOLY IM SO HAPPY IM SOBBING #TheWalkingDead
female	I hate when I use cars and their color to describe to my brother where I'm at, but then those cars leave _ uhh _
female	@GeorgieWatters @sham681 @MissyB_46 fab news!!, and he's right it's not over he can still do this is everyone plays fair!!
female	"It's the magical mistery kind, it must be alive"  https://t.co/rQkfo7Sdrq
female	@iamsharnay mine too. Bt I don't even have the outfit
male	Can't trash talk the GOAT on a basketball court and not expect him to deliver hot and ready baskets
female	@OlgaKay I'm being you for Halloween I've decided! and wearing your mosh walks! what kind of outfit should I get??
male	Praying for the victims of the Afghanistan earthquake. May God bring peace and healing.
male	Following #WWEHIAC and ahead of #RAW tonight, here's how I'd book @WWEBrayWyatt to be a monster by Wrestlemania 32 https://t.co/HZAOQcVSm8
male	PNAS "Science for a wilder #Anthropocene: Synthesis and future directions for trophic #rewilding research" @EcoinfAU https://t.co/2tdxISWPfG
female	Change of pace today. Had the opportunity to speak to some companies &amp; public relations employees about journalism. https://t.co/RSfdqn0afw
male	Number crunching for the past day - 1 new follower and NO unfollowers. Stats via https://t.co/Ka95HBPNQx
male	Doctors and lawyers: Computers are coming for your jobs, too - https://t.co/CH2BcXP5xl
male	@AReeceAuthor Thanks for following my tweets; Please enjoy yourself, I try to keep my tweets very respectable and fun for all :)
female	@BeauchampConnie She just sat there and looked at Connie as they got to the hospital
female	@ItsLeeHinchy #LeesQANDA what's the story in balamory?
female	remember that money will never wake up and tell you that it doesn't love you anymore
female	Oh yes the good old smell of fall and fast food
male	And now for something completely different.
male	but i snarled and made claws and stomped like a monster and the kids laughed!! she handed me the tape v carefully so i wouldnt touch her
male	Floating jack-o-lanterns create the perfect spooky lighting for an outdoor Halloween party!_ https://t.co/ycGr9Kq5Kv
male	when my jodhpurs come in the mail https://t.co/9LdmhOMgdk
male	@chartnews when does hello by slaydele hit the charts?
