male	@RLewisReports I'm so glad I never got into LOL and only have to deal with NIP magic in CS
male	@NBA im hyped for the new season because of the intense competition that happens every game after tip off #ThisIsWhyWePlay #sweepstakes
female	*drinks 1 cup of green tea* *pees 15 times in the following 30 minutes*
female	Rumor Control: RHOA's Sheree Whitfield and Carlos King Alleged Dispute Clarified https://t.co/pPtbAdMmsa via @AllAboutTheTea_
female	Banana I just got my text and it's Sara sending the taco emoji because she finally updated!! The update is what jacked my shit up ___
female	#DailyPropheticWord Identity Revealing The Worth Of Others https://t.co/Zf1B7Ooxfr via @NeilVermillion
female	Empty pockets never held anyone back. Only empty heads and empty hearts can do that. ~ Norman Vincent Peale
male	The Gospel Of Greed: How Sardar Biglari Paid Himself $34 Million Despite Lousy Fund Returns: Documents obtaine... https://t.co/l73SDAn6Kh
female	Check out the INTL Giveaway for an ARC of Sword and Verse hosted by @bbookrambles! https://t.co/4USmZyFTbw https://t.co/9W6iDa2Sd8
male	The buggy #fast #holiday #hot #sand #bluesky #dune #buggy @ Fuerteventura https://t.co/4OyiSPr1It
female	This is the second to last shot of the swamp. I loved this spot so much and I can't wait to go back_ https://t.co/NCcMbKp1qK
male	I was of dentist and the dark
male	@SecularScarlet We shall see. When the execution rate is down to zero, I'll give the story more credence
female	This is my cat darla she's very fat and she hates me. (: https://t.co/Ru0jIeN3yA
female	My absolute favourite people in the entire universe  https://t.co/hj3VshheO6
female	is it too early to be listening to the @michaelbuble christmas album...? ____ɉ
male	Don't do something for someone who ain't gonna do the same for you
male	With Phillip Dorsett out for a month or so i think it's time to promote @DC_CHILLIN_8 and see what he can do #WeNeedASpark #Colts
female	At the eye doctor by myself, being a grown up and shit _
male	Israel 1999 Abraham and the Stars 10NS 1/2 oz Gold NGC PF68 ULTRA CAMEO https://t.co/PXKxx16TQ0 https://t.co/aWBMcdg9sm
male	The Gospel Of Greed: How Sardar Biglari Paid Himself $34 Million Despite Lousy Fund Returns: Documents obtaine... https://t.co/gX367kuTzg
male	The sun may rise in the east. At least its settled in a finer location... #RHCP #realshit #eastside
female	The best way to predict the future is to create it. #ALDUBPredictions
male	Halloween costume idea for those unknowing of what to be: any of those food costumes WITH fishnet stockings AND heels. You're welcome.
male	@lewis_herbert @BBCNews its instantly refunded by your bank, without question and at no cost to you. You just have to inform your bank.
male	@ntvkenya #presspass , they have just created channels for politicians to use in spreading divisive , malicious and ethnic based politics.
female	@MommyPR @Candypo Loving all the ideas today, brilliant! #hersheysspookon
female	@2hot2yandle my parents are the same way with my ptsd they get anxiety and depression luckily. It sucks tho I feel ya girl _Ӊ___
female	I LOVE ALL MY SOUTH SIDE BOYS THEY RIDING ... OUT THE BLUE NEE U GOOD LOL YEA
male	@StonehamLane pre match beers will be taken care of by the quite splendid @BeerDockcouk
female	Happy birthday to the cutest twins around __ե @B_Dizzz and Jordan! https://t.co/DIowUEHmld
female	So I can just put an away message on my work email, shut my office door, netflix and sleep til 5....right? #thisisthelife
female	If you cant send an address then what the hell can you do?
male	Build a Transforming Workbench, Desk, and Storage Unit: If you don۪t have a lot of space, you need to make cre... https://t.co/Ta82IcoxAV
male	Seriously, how are you the celebrating the Book of Shadows: Blair Witch 2 anniversary?
male	@Monarc_Agency @wandecoal  Kpono, and monster
male	Apologizing doesn't always mean you're wrong and the other person is right. It means you value your #relationship more than your ego.
female	Imagine if i was, you ugly piece of horse's ass https://t.co/KNbXkVtQSO
male	@ContinuedSearch @BestOfMeech but I think that was the joke lmao
female	Gtfo of the bathroom and fucking make your calls outside you're annoying 
male	Oh my God oh my God abba just liked the status oh my God oh my God. Ya Allah mjhy uthaaa laaaay!!!!
male	Look at Ken Barlow putting it on Audrey Roberts the old rascal!
female	I'm a little bit on love with the UPS man who almost always brings me fabulous #BookMail. @Suzy4PR #INANOTHERLIFE https://t.co/PWoQ26uN5J
female	The day before the appointment to get my car inspected I get pulled over bc my car is out of inspection. #mondayblues
female	@RoundhouseLDN up the ticket there? Just worrying I won't get in.
female	Mass snap chats are the epitome of annoying
male	@clarencehilljr he sent a tweet, said guns a blazing and got fired up on the side lines. Get over it, find a real story.
female	@jennaaasusan that's literally the funniest thing _
female	"@twiigss: @twiigss how y'all feeling ?" Like a mood ring that's cracked and all the cracked pieces are different colors
male	This mornings class was over women's rights. This was all the notes I took. https://t.co/ODqZNHoLE7
female	this is what happens when your prime minister and his cabinet are out of touch and silver spoon fed #taxcredits
female	i hope i can just beat this bitch up real quick and go home and take my nap
male	Roll me a skunk "@Mizzpurple01: Now High and Ready to tweet"
male	You're independent and you got my attention
male	How can I get any work done? I can't stop watching this over and over. https://t.co/9GvLGdVIqr
male	Father forgive me for the gains I am about to receiver #RepsForJesus
male	Can't wait to play @Bedroom_Bar - London - UK this Friday and @exeter_phoenix - Exeter - UK with my mate @larryskg on Saturday!!
male	@xPandoraRS oka, but remember you're not a loser if you do so! you're actually brave and smart :)
female	@only1whitegurl i got 10 dollars and a food stamp card we can go to the store _
male	Really curious about how well the AZ beach bikes store by my place is doing. Last I checked there are no beaches in AZ though.
female	@VIIVIMCMXCIII duh _ and that's awesome. did you have a lot to wash
male	This is really, really good.  And I don't just say that because @MattCrossman_ wants the praise. https://t.co/pCsLOS6Kcj
male	@cinderelahoran 12h22min in a car, 14h40min in a train and 6h10min in a plane https://t.co/IqV8NIvvZx
male	@TheNotSoShyGuy I completely forgot about MGS and KH! Goddamn. I'm a terrible fan.
male	Oh but the way she danced to The Blood Medley... Lord it wasn't just dancing, it was ministry... I_ https://t.co/Oaiv0VSSK0
male	@Luke5SOS firstly I'm not a human and secondly it's morning __
male	@FinesseGod_Rob don't trust it he told me he was pulling up and ain't never show
male	Great. I haven't seen any of the new Walking Dead episodes and I just found out that Glenn died...
male	2) I love sports but the way the Dallas Cowboys play makes me really question why I love sports so much.
male	@katyperry you're a Scorpio, I'm a Scorpio. Your bday is the 25th mine is the 26th. The significance? None really, post happy bday
male	@LeeshaNDessy @Shady926 @Roman_567 @Dean_Ambrose82 I say give him the belt and watch him shine...
female	@bellamysguns NOT A LOT I JUST READ A LOT durinG SCHOOL AND I JUST DONT HAVE WORK TODAY
female	Threw my phone on my couch and it landed like this. #moderndayninja https://t.co/bYv43JHjZQ
male	@SkySportsF1 Scalextric have been making F1 motors for years and cheap
female	I'd take a coffee and, or both, a hot fudge sundae
male	Really...what about Delta state tribunal and Edo state Esako house of assembly @chichris https://t.co/GORgAkbnnH
male	@mrsvannasdall @creativeedtech that's wonderful! And like @jcorippo, we offer lifetime support. Remember, check this out. @CheckThisOutBR
female	Teen Wolf Is Now Voted The Best Show. 10/10. 4 Time Emmy Winner. https://t.co/UuBJDZM6TS
male	@tobyrieger just register at socialmediawall.me and try it for free for 60minutes. Let me know if you need a Coupon for a day
male	Wonder if anyone's gunna play on the word "season" as both quadrants of a year and a unit measuring TV shows with this Gilmore Girls news
female	@Valpakcoupons I heard pounding on the door and when I checked no one was there just a pumpkin in the doorstep #ScarePakSweepstakes
male	@CamMeekins the fuck man.. what happened to the lamp city days? You sold out faster than I expected..
female	While I have the time to get my diet and fitness back on track in definitely using it to the fullest lol.
male	@kfc having no buns/wraps/burritos and literally just chicken at Hampton, Peterborough. Have a word Colonel... #macciesfordinner #notlovinit
male	@wayne__215 lol it might be too late by then . _ the division leader change every week oss
female	I just want to vent to somebody who will listen and understand _٪_ُ_
male	The prayers that I struggle are the ones which involve seeking first the Kingdom of God and learning to trust that God's ways is PERFECT.
male	America is based on Capitalism people are Free to enjoy the Fruits of their Labor. Liberals looking for a Free Ride. https://t.co/HpheHgtJqq
female	homework and studying turned into coffee and Greys Anatomy real quick
male	I've run out of scary movies. I've run out of scary books. Even those photos of me walking around the city that I get are meh. Scare me. _
male	Photoset: chaosophia218: Sidney Hall - Signs of the Zodiac,ʉUrania۪s Mirror۝, 1824. https://t.co/hcUmcgp5NF
female	@brittneymeyer when I was in TN  I ordered a pickle with my beer and the waitress looked at me like I was crazy! Lol
female	.@IFAWUK R/T WATCH Blood Lions the Documentary makes its debut on October 28th 10pm @Discovery Channel #BloodLionsGLOBAL
male	@Grant_74 just a bit of gauze to stop birds nicking the seed
female	I wish i could have experience summer in the 50s https://t.co/yd7MoOXTAu
female	Gratitude is the first sign of a thinking, rational creature. - Solanus Casey #quote
male	@bigevvy10 Agreed. It's also the last thing the Cowboys need right now considering how this season has gone thus far.
male	@RyanPlaney @lukedenzer how dare you Ryan, they're people just like you and I. Don't classify them as diverse, we are one species. Faggot.
female	@kalynmd a true friend lent me headphones so I can listen to drake on the bus ride home w/o issues
female	@NiallOfficial hi is it possible Katy millar who is in the Newcastle crowd can get a happy 17th birthday today she's with Laura and Rebecca
male	When you fall and become a fuckboi __ (ib: @HolyCrapItsRob1) (Vine by Jeff Adler) https://t.co/tmJgyp3AvW
female	Looking forward to working in @britishlibrary for the next two days, nearly there! #crownofblood #teamtallis
female	Its the fact a canny swim and sophie turns around and goes "you swimmed when you were sperm"
male	why do people tweet like *falls off bed and lands in the pit of fire in hell*
male	@BreeBerry_13 that happens to me all the time! To buy food or die of hunger and save money lol
male	@BrookeBCNN There's no one else in law enforcement to book? You don't even agree w/ or like the way he goes about his talk
male	Stormin' the castle with #JEFFTheBrotherhood! @jeffbrotherhood @infinitycat #infinitycat #vinyl https://t.co/IJ9O0Bbwy9
female	I just want to sit down and drink coffee in a little pastry shop while I listen to music and observe everyone. Ya know?
female	Just took this out of the oven. Can't wait for dessert! #AppleCrisp _ٍ__ٍ https://t.co/dKZn8XsISr
male	@AvpisaacIssac shouldnt be because thats not what happens in the comic so im guessing hes still alive and it was just a dream or something
female	You were the first and last person I ever trusted.
female	Not crying on the treadmill to @Meghan_Trainor and @johnlegend. That's definitely not something I'm doing right now.
female	These guys from my school talk about sex in public all the time and I somehow always hear their conversations
male	My life is complete now that @MoniqueD__ and @ahook817 are fallowing me.
female	Hocus Pocus and chill ?
male	Its always the Rango looking females that wanna fuck with you heavy.
female	Proud of myself for doing well on my final, but it still doesn't change the fact I'm stuck with a "B"... #TypeAProbs
male	#TeamPAPii -One State۪s Struggle to Make Ends Meet: Why Illinois Is Without a Budget https://t.co/x5MEoDjvaj Unete  @TeamPAPii)
female	EVERYDAYILOVEYOU Forevermore  and what makes it last  #PushAwardsLizQuens
male	@DudefrumVA @HatfieldJason D only gave up 289 yards. #1 defense gives up 281.3. #2 gives up 283.2. And 3rd is 294.1. How is 289 a bad game ?
female	Beautiful Baby Albums now available: 20cm x 20cm, 20 pages with personalised colour overwriting and raised... https://t.co/BPUrwCyxpM
female	Hi princess of light eyes _.  You and a great makeup artist __ . You are awesome Lottie .  Please follow me babe ? _٪_٪ @lottietommo x528
male	@MLBModel Give it a name, take it to a vet and get it shots.
male	The Best From World MasterCard Fashion Week SS16 https://t.co/IcpfFaxyj2 via @popandpress
male	The only one feelin you is yourself my dude_
male	I had a dream where I was playing EarthBound and the only thing people would talk about was Undertale.  Phew, glad it was just a dream. :^)
male	You used to be my homie and now you act like you don't know me
female	If Ryan got rid of the beard I'd probably cry
female	Watching my favorite movie and doing hw _٪_ُ_
female	you church hos got the game messed up
female	Does red meat REALLY = cancer? \_()_/ but today's vendor lunch was BBQ ribs and I had 2 plates. #noregrets
male	@g_maurya @ShelarAshish Pali Hill full of Dog Poo, The Clean up squad should fine the defaulters.
male	@feminisms I wish I Was 16 and could drive
female	the honeymoon tour was a massive success..proud proud proud
male	@CineBroughton 1 more hour until #SPECTRE red bull at the ready #007
male	@DumbCreationist There's NOTHING new in the paper or it would be pasted on every TV screen worldwide! It's the same unsubstantiated rot.
male	Ahmad - Back In The Day https://t.co/HQoun4ojWo
female	All you have to do is offer me food and we'll be best friends for sure
female	Tom Brady again makes the exceptional seem routine in Patriots۪ victory over Jets: (If you want to tell me it۪... https://t.co/ViEQ1wF3hd
male	macklemore&amp;ryan lewis//and we danced
female	@BikePortland Can you call something an absolute shocker and also not surprising in some ways? ;) #grammarpedant
female	Cole randomly sent me a picture of us at graduation that I didn't mail and I've never been so confused In my life
female	@earthtoryley let you know when it's closer to the show and relevant _
female	Walked into Victoria Secret with the intention of spraying myself with some perfume, but instead, I buy a small bottle worth $60... What
male	@_MissZoe_Hanna *kisses your head and holds hand over yours*
male	My friends bring out the best in me meanwhile school makes me more critical and bitchy
male	@BulldogWX_0610 @TimBrando also didn't want to show everything we had this year that early and wanting to save Dak for the end of the year
male	@DiamondandSilk @theironicview @realDonaldTrump Keep on Stumping! We doing it here in the Deep and Dirty South!
male	@GovMaryFallin  your PR doesn't fool anyone. You really do not give a shi*t about anyone but you and your dynasty. God Bless these families.
female	Green tea helps u to lose weight too. Hence and therefore very impt
female	#Bitcoin reaches 55,000 Active Users through Georgia۪s #UniPay: Leading bitcoin wallet and_ https://t.co/qDrgH7p94J https://t.co/Pxc6NVGuFw
female	@KatieLynnTate pre-sale the 6th general the 7th
male	@BillyBoomers It was pretty out there. I just found out one of the other Shulk's I found as from the Euro Cosplay contest.
male	@kel_kel18  lmfao that and the Chinese food at the Oviedo mall. Everything else is basically useless________
male	@IlliniFootball free tickets for the students every game
male	@Schopptalk how many seasons in a row, have the Bills been forced to go to the 2nd or 3rd string QB? #whyus?
female	I hope my kids have their dad in their life cause I don't my kids to ever feel the way I do.
male	Working with the fourth dimension like magic; hacking the system and accessing cheat codes.
female	The Impudence of Rabiu Kwakwanso and his Fulani brothers - by FFK: Written by Femi Fani-Kayode...Read below..I... https://t.co/GTwLhIeOqJ
female	S\o my dads old friend went to a phs reunion and saw this miss you dad_ #rip https://t.co/ruqFYwJYJI
female	#ShoutYourAbortion and #ladypartsjustice let's try this hashtag. #itwastherightchoiceforher.
male	A savage can only be retrained from savage actions by good law and good law enforcement.-THMLF
female	@uSTADIUM thank you and yes he is! _ #5ģ9ģ
female	This has been the longest Monday ever___
female	SELLING TWO EDCO TIX FOR THE LOW HMU
female	Hello ! From the outside. I must have called you a thousand times before you changed your number,AH !_
female	Why do a lot of dudes in the Air Force look like they just graduated the glee club in hs _
female	Hi princess of light eyes _.  You and a great makeup artist __ . You are awesome Lottie .  Please follow me babe ? _٪_٪ @lottietommo x526
female	We only have terrible fights every now and then   Also she's the popular one and I'm the ugly one so there's that
male	sitting in McDonald's deciding if I should get food or make the healthy alternative and go home and eat a slice of toast.
female	Build a Transforming Workbench, Desk, and Storage Unit https://t.co/no92jmpYFj
male	I'm a sample of the beautiful light God sets up in dark places to show others the way, rarely recognizing who they are. (say it to yourself)
male	Thanks @WinkMartindale for the shout out! I۪m looking pretty good for 75! #FamousName https://t.co/UMrFosWY0u
female	Having a rubbish day! I waited half an hour for my bus when it said due. Only to get on it and have it terminate a couple stops after.(CONT)
male	@vrizov Sadly it۪s about people who eat two pieces of bacon a day and get cancer.
male	In order to play The Joker on screen, one must completely lose themselves in that character. In the end, The Joker truly wins.
female	Stats for the day have arrived. 1 new unfollower. Stats via https://t.co/Y0X7NEDMXZ.
female	Me and @SimpsOlivia danced to this at hoco_≝__ https://t.co/JudtiEP9HH
female	young teacher   the subject  of schoolgirl fantasy
male	Ppl and their lying __
male	Dooda Got The Trap Goin Nuts __ , DBC Telling Me Its Just Us __
female	"If you expect the world to be fair with you because you are fair, you're only fooling yourself."
male	"We're beyond lost and on sinful path. Wallahi this is so sad.May Allah guide us all to Islam.#earthquakeinpakistan https://t.co/IeC3c2inPz"
male	She know i get them checks and i dont speak at all
male	Done fell out with all my brothers at least once. But at the end of the day, we all still tight. __ُ_
female	Order today to save 10% on Nitro and Inner Defense! https://t.co/kxjAfbmL2O
male	11.06.15 the Battle @ me casa  finally starts #LipSyncBattle
male	Greg Hardy you a good player and all but don't get in the face of Dez Bryant. Learn your place mane.
male	@PanicItsPeter Whichever ones are clean. And practicable.
female	just sent my brother the best happy birthday snapchat heheheheh
male	You're yet to see a babe with big boobs and no ass. https://t.co/MzSNFEBGhj
male	#FFIEC introduced new tool with a measureable process to inform assess organizations #cyberrisks https://t.co/5HmsRzJpmH
female	"Like disco and hammer pants"   #quoteoftheday, you guys. Quote. Of. The. Day.
female	Uno and chill?
female	IM IN THE SPIRIT _______ https://t.co/XVYzkFAYSJ
female	@Cofe6370 @BIGJAMES_2 @MeeMichie @mestasenesta @Imdatchick1985 I don۪t know why these women agree to 3some in the first place! #Stupid
female	Method involucre publication freight lick the vital impulse call up relative to the regular customer: DSgT https://t.co/fBLucfmw54
female	The stigma against medication needs to stop.
female	#mondaymotivation COFFEE!!! That's the only way I make it through.
male	@HisSavior_ The Doctor would follow behind, walking up to the counter and holding out his psychic paper to the man behind it. "John Smith--
female	Former @SeaWorld trainer John Hargrove and Dr. Ingrid Visser expose more about the infamous marine park. https://t.co/ccN37RcMiz #Blackfish
female	MY TEACHER IS TALKING ABOUT SHUCKING CORN!!! THE SONG CAME INTO MY HEAD OMGGG__________ @lmmejia35
female	Me and @gabrielle_lamb should of been put in a taxi there and then!___ https://t.co/BcGx2cyNTV
female	@kate_halloran you forgot the O' in your @ name
male	#MuayThaiMonday one of my favorite heavyweights the "Red Scorpion" Alexey Ingnashov of #Belarus_ https://t.co/RJEl5R7ZdU
male	Telstra's thoughts about the Internet of Things including Infrastructure enables innovation - makes senses.   https://t.co/1kdZhpARQn
male	@KaHS__Tomatalk why ain't I on the wheel :(
female	Shantel em The Flash _ժ_ժ_ժ
male	@Robstagg12 but for now you'll have to look in the mirror and under the sink mate!
female	@lilyjohnsonnnn obv you would want to rewind to a time when tess was with noah and not with H bc u looooove him
female	That moment you wish you were @lauranotclaire because her life is amazing and she has met @halsey 639397 times _
male	the threat that their traditional business would be over / accessible for everyone must be scary indeed. https://t.co/pSGR7V4Q5D
male	Nice history of the ADHO DH and Libraries SIG by @gworthey Early issue was lack of internat'l representation. #DLFforum
male	@NFLCharean @clarencehilljr ask garret if he would've gone for 2 and the win if they had scored.
male	And it's fucking female
male	I Tell The Truth And Get Called Rude ,, Shid Oh Well !!
male	Gonna be recording the Wonderlocke soon. Not sure how many encounters we will have though, BUT BE READY TO TRADE!!!
male	@GrahamWolfe1 you do a raw charge yeah, but you can walk forward s.HP everytime, only stomps dont reach and have no charge. Kinda wack
female	@LaurHof11 don't look at me. I was up all night with a sick dog and then Ross' car acted up so we had to get it fixed. Epic fail of a day
female	These+Are+The+Best+Carbs+For+Getting+Leaner+And+Stronger https://t.co/ZAL9aj3C1h
female	you ever look back and think of the people you lost and kinda miss them but you know you're better off without them
female	The only problem is I don't know how to apply eyeliner on my Asian eyes _
male	I wish I had the money to go to Tahoe for the first week of Winter break and do some skiing
female	I just really need my hair to grow and my skin to clear
female	@truthismaster so true. Myself and @ContraFacta got verbally assaulted by one yesterday. Offered her reason, received venom &amp; block instead.
male	@JovinnSidhu thanks for the reply, you are very welcome!
female	idc this the goat still https://t.co/s86cnMCtoX
female	|REPLAY| How to get the best deals online #PFSScopes #SanitySavers #katch #Periscope https://t.co/4FJRYfcSUL https://t.co/GkoR6geqP7
male	@radloveniall permanent vacation is one of my favs too, outer space is so magical and omg I can't believe the instrumentals
female	Madhurima Nigam rocks with her Indiyskyie Menswear for ABHD... Amal Malik and Armaan Malik with Madhurima...
male	@W101Spoilers ugh. I'd got the per pip and like no after effect __
female	Oh, and if Thing 1 or Thing 2 or however many of you there are ever have something to say about me, @ me.
female	@_Aphmau_ the pic defines all mcd fangirls/fanboys and mcd shippers xD
female	Love likes the fire, it can۪t be made a fool, it would burn your own
female	#Win an #IttyBitty bundle to celebrate their arrival in the UK with @HallmarkUK and @RedRoseMummy #collectibles https://t.co/rP0x85qYSf
female	Give me the syllabus on your relationship
male	When you're teacher tells you to turn your music down and you give him a look that you know looks mean af ____ bitch ass teacher_
female	I'm so ready for hit the floor to come back on g
female	Love this pic and love you_ @ Camera Obscura and World of Illusions https://t.co/qekEREQ2Tg
female	Young, wild and free !!*ۉ_
male	Pierce didn't move his car so the trash boys could get too our trash can, therefore me and t bigz are going to give him hell.
female	Eating my #eggwhites in the car while I'm waiting to pick up my son. #ontrack
male	I liked a @YouTube video from @mrtonymui https://t.co/bNDjK6zMw5 @UNDERARMOUR CURRY 2 - THE CHEF IS BACK!
female	Mike Newman and Gina Campbell celebrate the new record. 120.4 mph in a 5.5 tonne truck. @speedofsightorg https://t.co/FYRXP5rSRA
male	Fuck cuffin season. Imma find me a chick with at least 3 kids and in school and cuff her in January for tax season
female	everyday my dad makes sure he tells me how proud he is that I speak my mind and don't care.... my momma on the other hand __
female	spiders are the worst _٪_ُ
male	Check out the largest pink diamond to ever be auctioned, price tag starts at 15m: It's called a Rare 'Fancy V... https://t.co/00ZAue0wBk
female	Transforms and Fast Algorithms for Signal Analysis and Representations, Yonghong https://t.co/HE78HF8Qta https://t.co/hY3R2lcjPj
female	Its just so hilarious to me that all these guys i used to crush on and dig back in school are trying to get at me now...haha
female	Day 1: twin day with the one and only Allie Kane https://t.co/ULvf1dMSpt
female	Is the criticism of a female billionaire sexist? https://t.co/5nq32OOJ22 #askingdifficultquestions #thenewfaceoffinance
female	@naeaiko @leshebeauty Yo! I found the funniest shit from us 3.
female	When you see Emir and he starts telling you something in his Bosnian language like WHUT did you call me?__
female	Kyle has all the kids halloween songs stuck in my head____
male	@Shizz_ROD5 @KyeBillyion before the winter just gotta cop the program and I'm set! Got everything else
