male	@RLewisReports I'm so glad I never got into LOL and only have to deal with NIP magic in CS
female	@ImALegendKiller @fangirlnextdoor I'm thinking more and more he's alive. That's not how he died on the graphic novel but that means nothing
male	Harry Potter and the Threats to Israel https://t.co/Gr9uztCIza
male	Killed the interview! Here's to a raise!!!!_ԏ_ԏ I got laundry to do!
female	@LilBoii_Panda Evelyn helped you to the car _ i regret drinking too early I should have started when you got there ___
female	@leeco197 We used to joke and I used to take a grilling but lately hes just been personal/critical. Then I react now im a mong, paranoid etc
male	Planned U.S. patrols to raise stakes with Beijing in disputed South China Sea | The Japan Times https://t.co/IyPbi1GTVm
female	Despite the two bottles of vodka Hannah had to herself last night, she's convinced she hasn't got a hangover and she's just 'ill'
female	H17BD TORI ____ i hope you are having a good day. I know we aren't the bestest of friends but you're still my friend and i love ya crazy self
female	so I actually did something for once in Montys class and he's making me redo it ___Х_ُ_
female	You can work on something so hard and for so long and then it takes only one single action to break that for you.
female	I was highly amused when someone turned round to me in tesco and said your abut tall for a 5 year old __Ԥ
male	How many children will die today as a result of sexual trafficking and perversion? These are our children... #InspireADifference
male	Promax and IBM announce Security Intellligence partnership from the Cloud designed for MKB #qradar #siem #ibmsecurit_https://t.co/1A0xRtIW3Y
female	I could honestly watch Curb your enthusiasm and big bang theory AWWWWWWLLLLL day!
male	#nyrrvirtualtrainer I truly wanna be there and enjoy the most !
female	@JackBMusician Listening to 'Along the Trail of Tears' and I love it. Real, JD drinking music. I may never listen to anything else.....
male	@DaynaSharp_ mould killer gets yih real fucked hahaha and don't ruin my buzz
female	"My body is a temple so never let a man in that doesn't take the time to worship u bcuz u are a goddess that is truly worth sacrificing for"
female	Are "green" and infrastructure job programs being considered by politicians to support MN workers?  #MNleg #1u   @aaronklemz on @AM950Radio
male	@British_Airways yeah. But my 'pushchair' is a frame and wheels and a car seat for him to sit in. Will this be 1 item and cot a second item
male	When u want something so badly that everything else fades away and that one thing is your entire world... You know you will succeed
male	Guess I'll get my hair cut and let my bestfriend do something to it
male	When the bread on low all my niggas on go __ new sauce for the week _٪_ُ_ #LostInTheSauce ft. @iamzipk _ُ_ُ_ https://t.co/VGCf8fUm5d
male	@PaulICMYAS you make wishes come true. And your humor is great! The love of your father shines with you Paul!
female	@davidamackey Came across this and thought of you Dave, ready for another cup of #COFFEE? https://t.co/jOuS8tW1mp
male	I once drank 2 litre ya Mageu and ate bananas + peanuts and that girl didn't show up.
male	@ElainiMcMahon _thank you and miss you to elaini lol
male	@alexdavis544 "When I get back on my feet, I'll blow this open wide, and carry me home in good health."
female	@MeganAlder98 I checked and it was fine, but we couldn't sell gkn when I realised bc the stocks were closed then
male	@lsjustice4all PTL brother, such a wonderful blessing to hear how the Lord is using you and your family in the ministry. Keep it up bro!
male	23%of households are concerned about the #mobile #health #security of #connected #devices https://t.co/TumdLpPqZ9
male	GSI Super-Quality Multi-Function Mini DV High-Definition 3MP Camera/Camcorder/Webcam/Voice-Recorder for_ https://t.co/DFo4qdk26i
male	upon grabbing the tape i skittered away like a monster and the kids laughed as i went out the door :,) 10 minutes later i go back over
male	#LifeHacker Build a Transforming Workbench, Desk, and Storage Unit: If you don۪t have a... https://t.co/dSGAcM75z7  https://t.co/NQhw0Ng904
female	@ConnorFranta &amp; @JoeyGraceffa I was watching the little couple and your books where in the background
female	@HalpernAlex it's a miracle I heard about the report at all. I read it while doing laundry after Hux peed all over me and couch.
female	Shoot for the moon. Even if you miss, you'll land among the stars. ~Les Brown
female	@jmoneyescobar it's not even the lyrics were bad the delivery was ass and his voice is annoying _
female	@richardbranson "Maybe the answer to the danger that drug criminals will move to other crimes eg trafficking is to legalise them."#FALive
male	How surreal would it be if police and soldiers were to protect students writing exams against those nitwits who don't? #FeesMustFall
male	If you're on my fantasy team you're supposed to be good. Get off your knees and stop blowing it for me.
female	Love that station... walk the 5th Ave and suddenly on your way is this great building. Maricla Kandzorra https://t.co/WGWZH0DrYO
male	The irritation of dad's who only care for their child and don't concider that there are others in the room really bothers me
male	@mennohulshof USS Lassen (DDG-82) is a alreigh burke class guided missile destroyer. Already in the South China sea or near it.  #China #USA
male	in most cases people won't speak of your achievements, so do yourself a favour and tell us how great you're but be humble about it
male	And Asa is really fit too bruh
female	Season 7 and still everyone from Scandal is showing up on Greys _
male	October 26th and I've just seen a house fully Christmased up, don't want to see their electricity bill #onceafinancialadviser
female	Daisy's actually so tough she leathers me and bran
female	Everyday is harder and harder without you. Greatest lost I ever took! 12/31/68-10/26/08 RIP! Forever in my heart! Love you Uncle Frank! __
male	This rant is on point. Music is about entertainment and its that simple. https://t.co/Sq2TZGiQV5
female	THE FLEETWOODS- " COME SOFTLY TO ME " favorite song forever _ե_ե_ե https://t.co/CzTjs9Ma5u
male	SOLD this weekend in Delray!! Come in to the gallery and view Mr. DeBilzan's newest pieces!!
female	The mama bear in me is about to come out on you and I really don't think you want that to fucking happen.
female	Complete the Swoof Sphinx wonder and build your ultimate #SmurfsVillage. https://t.co/MmUHV6Kxfw @BeelineGames
male	Finally done with work!_٪_ُ_ Now, off to the gym. _ԍ_ُ_
female	And I tell him they need to put a sign up that's say dirty and thirsty do not mix ___
female	Join Superpoints and gain gift cards with the push of a button. https://t.co/QVg0nu1UmC _
male	@xBloodxTitanx I blame the fog machine
male	the struggle_ https://t.co/QYe9eNxbEP
male	@LFC on Wednesday we should start with bogdan in goal. In defense our back 4. And Henderson and Alan in midfield. Then Sinclair and ibe as:
female	The cookies look amazing _
female	@_love41D Can you help me spread the word about my app, Scope? Find out more: https://t.co/rrIFS8s3EK
male	@tisanb who sang the Java an song?
male	Di Henderson is our Guest at The Welly Folk Club this coming Thursday, 29th October 2015, a very fine singer: https://t.co/PAGGBZmF06
male	First time talking to the group and already frustrated
male	@EliotHiggins I told you he was grilled on dutch tv. It was not in the report. I could not find anything on US sat pics in the DSB report
female	@MaddisonT2376 @JustinDBVoter the lyrics video or the mv I'm not sure but he held your record for the fastest video to reach 1M Likes.
female	It's either going to work out or it's not and there's only one way to find out and that's a lot of patience. :(
male	#weasone the countdown continues!https://t.co/wfLsIiCE5t https://t.co/p8mpgcqN0j
male	Ready printout outs in transit to unravel in serene since population at this juncture in hand the trek: SkSH
female	Young girls are the cruelest bunch https://t.co/6H57gl2Nh6
male	Off to the flicks with@RajGhatak to see my predecessor @Danielc1968 in#SPECTRE
female	If a nigga hits you up and you screen shot it and post it on a social network you are the weakest link and SUPER thirsty for attention
male	Seriously love Trent and Justin. Would do anything for those dudes.
female	college is hard , and I wanna go home
male	The Gospel Of Greed: How Sardar Biglari Paid Himself $34 Million Despite Lousy Fund Returns: Documents obtaine... https://t.co/HlBpPdgxGE
male	@KarlreMarks Shelden Coopers of the world, eh?
male	@nochiefs That can happen. It did with me and ice cream. Hardly touch the stuff today. @BuzzFeed
male	@GaliaArad you'll do great. Because you are great. Enjoy it. And have a Jameson for me afterwards! :)
female	doctors think you got all the time in the world to sit in a small dry ass room
female	when you have a portfolio review at 4:30 and you get stuck with the slowest bus driver ever
male	About to go grab Chipotle and then head to the library
male	15 days till Vegas and seeing @claytonharris_ _٪_ُ__٪_ُ__ُΉ_
female	Make sure you try microwaving leftover peeps when you get sick and tired of them after #Halloween #fnichat _ https://t.co/REKMFec25t
male	I just saw nikko hes alive and kickin of anyones wondering.
female	Happy birthday to my sweet Kate_ thanks for being my mom and for always_ https://t.co/rVQLdPcNxu
male	@uglyPEEDI just one song and video and a feature with Cobra Starship then she stopped
male	I live for the nights I can't remember with people I won't forget _ٍ @ Sherman Oaks, Los Angeles https://t.co/1XRSynHf8N
male	Excited to see @kevinwatson at the Bishop's Symposium this week! #JohnWesley #classmeeting #discipleship #holylife
male	@Wilfieboy99 I use my local parish or the DAV (which is a US military veteran org) as both my Dad &amp; father in law served.
female	THE WORDS HAVE BEEN SPOKEN !  https://t.co/qTwMaVO19Y
male	@pratt  We use @Optimizely. They have a great UI and it's easy to use. The tests are easy to set up and their support is  phenomenal.
male	All you magazines, and writers y'all suck dick. I hate a lot of the shit y'all do... So we really up next, and we really for the culture.
male	I got no time and I go no respect for the people who don't put the apostrophe in hallowe'en
male	@UP10TION #HAPPYWOOSHINDAY feat. a bit of xiao and hwanhee  happy birthday u cute dweeb ! i love u so much ! https://t.co/wqBEigw8d6
male	Exhausting is okay. It means you're in the game. You're on the way up and you're not on the way down. - Lee Rosen #quote
female	Train went in the opposite way to what me &amp; PJ thought, so I looked out the window &amp; we made the same expression so now I miss him already
male	I liked a @YouTube video https://t.co/9W9Wkzzhzn Josh Daniel takes on Taylor Swift smash | Judges Houses | The X Factor 2015
female	Coffee and Tea on Tap https://t.co/OrApujld4A
female	Tell 'em to go out there with all they got and win just one for the Gipper.
female	you don't have to get to the top of the mountain to enjoy the view https://t.co/kfS2I9xgtB
female	Bless APU for blasting Reliant K and Switchfoot at cougar walk_
female	#tbay police have charged Anthony Paul Marino, in connection with Saturday's fatal hit-and-run. Details @ 6
female	"nellie has the best body ever. my cause of death, probably."  anonymous.
female	@knowhowtohelp my laptop has been written off without my consent. I did not want it to be written off and would like it back.
female	All the girls went to sleep and the guys just sat in the floor and watched us__
female	If You۪re Lucky https://t.co/bcpjSGrQY9 I reviewed this book for The Washington Independent...and if you feel lucky...read it now...
female	Really hard doing a sociology degree, lecture got cancelled coz the film wouldn't work
male	@henrydampier Rock the vote.
male	@AutumnWater_ i feels you but i did that on facebook i made a new one and now i only got like 50 friends
male	Police upset technology means their dirt is now exposed for the world to see
female	Two soundtracks that will never fail to bring tears to my eyes: scores from the Lion King and Titanic
male	I've been watching Fantastic Four for 10 minutes and I couldn't resist the thought that this is a mini House Of Cards casts reunion. Hahaha.
male	Starting the gym for serious
female	@hertslife shall we talk about half term, and Halloween?
female	how come beauty youtubers like can't grasp the concept of waiting till liquid lipsticks have dried to lip swatch them
male	Catch Fire is stuck in my head and I can't stop singing it! ITS FUCKING RELATABLE TOO AND IM JUST LIKE, ughobfzfjy! https://t.co/QD4f34efhe
female	Setting goals is the first step in turning the invisible into the visible. - Tony Robbins #quote
male	All the kids and parents who was @CA9Football beaversbrook @SkySports will be showing the feature from 6am onwards tomorrow ____
male	Look out,buhari is coming,he is the killer of mother's and children @timesofindia @indiafrica2015 tell him to free Nnamdi Kanu #radio biafra
female	We should have a 5 year reunion... I think I'll hit up Gabby and see whats up
male	Exeter at home come on didcot so good to see my local side in the fa cup first round #FACupDraw #DTFC #didcot
male	@bolton_abbey It had changed so much since I last visited. There's lots for kids to do now and great access for push chairs. Great day out!
male	Need a weekend get away just me and a lady..
male	Support my good friends @fourteenk and invest in them on @perdiemmusic! https://t.co/4NI5cEjyP8
female	Thanks @MrSmith400 for the follow! You might like https://t.co/YWnNmTw9HI #education
male	Rain, rain go away come again when I can sleep and not have to study.
male	@J96RDN listen to the song called something new. I love it. I like melodic house more than anything. Which isn't technically house
female	And here I am sitting in a therapist office waiting. Fml. I'm so fucking sick.
male	@CFBMatrix a large part of the defensive issues are a lack of consistent offense. Baylor game had good 2nd half offense, defense played good
male	@crazyfillyjonk I will gladly pass up anything containing even the slightest hint of scorpion.
female	@amandaddington applied media and communication arts. Best decision I ever made! The teachers are amazing and you meet incredible ppl _ե
male	The ADA and you. How does this regulation affect your office? #askHCSI https://t.co/i3CLomKeMd
male	I hope temple and notre dame both lose on Saturday
female	@Z100NewYork please let me attend the future now vip party tonight i love demi and nick #Z100FutureNow  ___________ x123
male	Goodell went all out after Brady about some BS meaningless balls.  Greg Hardy is a criminal and Goodell ignores it.  Priorities?
male	@DolphinEret You're irrelevant. Are you even gonna be active? You'll be out of the league and Brady will still be winning rings.
female	Ngl I'm probably the only black girl listening to country in Greensboro rn
female	Check out my @Goodreads book giveaway - only 4 more days to get on board!  https://t.co/zcMS0J7xMS #bookgiveaway https://t.co/VgZ2xW6qfV
female	The one Spanish class I need is all filled up :')
female	Alfie can now play the Xbox in his bedroom! Peace at last and my bed back _٪ https://t.co/os9kiUkEnR
female	I think the clip at the end is from hometown _٪ https://t.co/XJWJzzeJHf
male	Oh dear, it's 8:15 and @TalkTalkBizCare 's promise of "not slowing you down" is proven to be a lie yet again. My 23Mbps service now 5mbps.
female	@CuestionMarque Don't forget billions in subsidies given 2 wealthy farmers. At the same time slashing benefits 4 starving children.
male	Most people can fuck up on they job and get a do over...not no fuckin Doctor!
male	- All these girls shouting "Yoruba demons" up and down, you see the picture of our new Grand patron as Ooni and yall start to catch feeling.
male	@house lol I just think it's funny and endearing. The last time I was in Austin, people said 65 F was freezing hahah
female	The sun will rise, and we will try again.
female	@MaxGeorge the first time i saw you live __ #MaxMonday https://t.co/pKT4fk2Btl
male	The Science of Compassion https://t.co/KTwZOxDHr5 #patientexperience
male	The Algorithmic Future of Education  The History of the Future of Education @AudreyWatters  https://t.co/B9CWvNXmqs
male	@chaseyerself for the bairns, my ass. People are obsessed with it. Adults more than the kids.
female	@meaaaganbs me too! We have been living there without hot water for 2 weeks and finally had the gas connected today. But no dice _
female	@amypond27 oooh, I would like to hike some of the canyons around LA, but I just don't want to go to LA lol. Thanks for the email hon.
female	5sos ft my ripped jeans, nikes and smashed iPad ____٪_ https://t.co/Zodtb2zFfN
female	@atiretsilb im tired of this shit mane  i cant slay these skin fit dresses and shit
female	@ChrisOflyng you should have stayed with Matthew, he can take care of you and cuddle
male	I added a video to a @YouTube playlist https://t.co/6gcNlHc4Jx Rockin' Around The Christmas Tree Lyrics
female	maybe i should just buy another one mine is for the science division but i want command and engineering ones too
male	And got more yards AND points than the Jets gave up all season. https://t.co/gdfkaOxcDD
male	Before the money there was love, but before the money it was tough
female	The revelation re the mp3 pugilist yet whichever in order to attend since continuity buy conjoint:: mbcQOVo
female	Mystified, just spinning 'round in circles, drowning in the silent screaming with nothing left to say. #HadEnough #Lifehouse
male	To the geese trying to cross the highway...you're gonna have a bad time.
female	Just watched #scandal and caught up with #HTGAWM yesterday __٪_ُ__٪_ُ__٪_ُ___ُ_ #ShondaRhymes is genius
female	Come out and party with me for the GRAND OPENING of #KabinSundays                                Text_ https://t.co/3QY1cuPzFr
female	My memorable MOMent was pumping in a bathroom before an interview so that I was not engorged! I got the job @themoms https://t.co/0lYsDezetq
female	Listening to fleetwood mac and seeing how far I can bend my fingers without breaking them
female	We have friends coming to stay this week, so we've cracked open the Halloween decs. Although Oscar_ https://t.co/Rk50Mgs6Pu
female	@Femibuster He's saying I went back and deleted tweets. I didn't. The entire conversation is still there
female	This was when 7 was the end and i could think whatever the hell I wanted
female	@Caren329 @NantzJuDo4ever @CapeMcMoose She finally is breaking away from the daytime stigma, I could never wish her back.
female	@YorksSocialist Most important is the story anyways! _ Really hyped! Wish u a good evening; leaving twitter for a while for some Watchdogs.
male	*NON-SPOILER ALERT* I can't believe that thing happened to my favorite character in last night's episode of that popular show!
male	Jk started waxing my car and fixing scratches and I already feel better
male	And Niggas  https://t.co/bcV1Dpv73c
female	If your stress levels have hit epic proportions and you feel yourself spinning out of any semblance of control clap your hands
male	it is part of Sydnex inc . And become a person with a successful future. What are you waiting for. Join now !! . https://t.co/bxChkFe106
female	got the job _
male	Photos : See how Rooney celebrated his 30th birthday at the Hilton Hotel in Liverpool https://t.co/fp4oW3SVen via @OkGist
female	@taybaum9 missing a day of the Bahamas just to go _
male	The little things you do always get me heated
female	my mom wants to know why i bought my baby 2 pairs of tims and she isn't even here yet.. lmao cause bihh, they were on sale.
male	When the ol boy say 5 minutes its really 20 minutes __
female	Lol that's not the reason stfu
female	ya fucka ill never order halloween shit from China ever again. Would of been quicker to cartwheel there and back to get me mask anyways
female	I just whipped the mustang for the first time and lemme tell ya...it was not that bad
male	You have been visited by the road sign of good luck. Fav this tweet within 10 seconds for good luck for 10 years https://t.co/7UenZRc1I2
male	@MattJones36 Damn... All the hard running he does and he goes down stepping on his own lineman.
male	It felt like they were my friends and I was living the story with them۝ https://t.co/arngE0YHNO #retired #IAN1 https://t.co/CIzCANPQFz
male	+ and i was like "why arent you asking me about both" and shes like "what do you mean" so im like "why are you just asking me about -
female	@taylor99leigh in the tweet it had a time thingy and it will let you make one
male	I'm not the strongest physically but mentally...mentally Iv been through_ https://t.co/fHhIUG7n4E
female	Loving can heal, loving can mend your soul and it's the only thing that I know. I swear it will get_ https://t.co/fThUgFgTFL
female	@DaDonDJSpyda thank u , I peeped the like _
female	@mattiefox_ I wanted to hangout. I told her I was working so I couldn't and she never responded.
female	Mets, Jacob deGrom made all the right moves in shift from shortstop to the mound: This was never a part of the... https://t.co/KxtDfRGdmW
female	The Most Likely Next President Is Hillary Clinton https://t.co/nozHcHFmZy
female	When the hairdresser asks u what products you normally use in your hair but you suspect just saying 'shampoo' is not the acceptable answer
male	Love the Atheon trips off of the tower joke part of one of the missions!
female	So cold and shivery and ill _
female	Stand out in the crowd _٪___٪ https://t.co/rGhJacGh4D
male	@boilerfan18 @LadyKrimZen unfortunately rare is owned by Microsoft and we all know what they've been doing with banjo kazooie
female	Stacks and stacks of school work...
female	Don't #selfie and drive @russmarchand #boo #brunch #monday #safetyfirst #rustyrhea https://t.co/ryNNCxHLrI
female	rp-memes-cafe: Tell me why you followed me and what made you stay. https://t.co/92WAEmSXB4
female	Hey I Just Voted for @onedirection for #ArtistOfTheYear Go Here https://t.co/g7keeR8tKt and Vote for your favorite!  #AMAs #OneDirection
male	Ken had a dream about Deirdre hanging out the washing...the party never stops in the Barlow house #corrie
male	the spirits of the dead are not only around us but they are also inside of us
female	This wan an improvement from all the other roasting videos https://t.co/PtI1NVcMdF
female	Read about pressing issues of CEOs, CFOs and CIOs  and how they deal with them - today's WSJ Report, C-Suite Strategies. Great insights.
male	the junior doctors had civil unrest in london yet hardly reported
male	Be In The Lookout!!! ___ https://t.co/dfZqv6Kjbh
female	@StephMcMahon @TripleH Great picture...congratulations and happy anniversary _ hope you have many more happy years together..._
female	@hands0nic I'm telling Rupurt that Lil is becoming a bitch and he should get her in check or they need to break up
female	When I saw this my heart stopped and I looked like this https://t.co/2r3hruZMMM
female	"Spectre" world premiere: Daniel Craig and his co-stars certainly looked like special agents in their sophisti... https://t.co/lk2pxWFFN8
male	Especially when they've been burned by players in the past... (2/2)
male	@FootyAccums Di matteo he won us the champions League or gianfranco zola
female	And you stay on my mind I think about you all the damn time
male	Who decided the way we should live our lives is based around a piece of green fabric?
male	Washington Post: #Iran marches, Russia rules, #Obama sits back and watches https://t.co/Atv2UosAvs https://t.co/7Mo0UjIoiG #USA #Canada
male	The Impudence of Rabiu Kwakwanso and his Fulani brothers - by FFK: Written by Femi Fani-Kayode...Read below..I... https://t.co/9X5Ke4gM5t
male	I'm voting for @NICKIMINAJ "The Pinkprint" for #AMAs Favorite Album - Rap/Hip-Hop, you can too here: https://t.co/7pMkHsaLh8
female	also i only got 3 hours of sleep last night and im Dead
female	Two Hundred and Twenty-One Baker Streets:https://t.co/7Fqs3aOuNX:Kindle Store - https://t.co/lbvRyfbm3E
male	@IAmKarma_Bieber Can you help me spread the word about my app, Scope? Find out more: https://t.co/lLZ3jHu4sZ
male	Even though they might not appreciate it or acknowledge it, always go above and beyond for them. It will pay off soon ;)
male	Taylor Swift in the Haunted Hallway! #Hilarious https://t.co/OAT0HzaFuH
female	I wonder what's the problem _____Ձ_ُ__
male	@RobHicks_ This is just what Baylor needed. Losing a QB (or two) worked for the Buckeyes last year - regrettably.
female	Ok people get with it or get out of the way, I'm trying to get home.
male	@British_Airways I. E. Ryanair take frame and car seat as 1 item and then the cot. All free
female	My sister just said that Niall's and Louis's voices are crap...
female	I will forever prefer simple and elegant
male	@VueHelp then when i have gone to book tickets got thru to payment screen and a msg came up when processing saying there has been a problem
female	@raseelj you need to try the philly roll that's the best one ___
male	@BrittSween @stacybud123 Just wanted to say. You have the most beautiful smile Brittany! It certainly brightens up my day!
male	Seriously about to juggle two jobs and school
male	Skulking about with a gin and tonic _ٍ @SanB5_2
male	Greg Hardy you a good player and all but don't get in the face of Dez Bryant. Learn your place mane.
female	@PurelySocialTip Yes, the new features may saturate, but there is still potential for effective marketing through these mediums #contentchat
female	Haven't watched any of the debates so far but dear lord. All the Republican debates so far in under two minutes https://t.co/o9iscOsbgM
female	@OSFKasia "In expecting the global South to deal with the drug problem the global North must recognise that it has outsourced it." #FALive
male	A throwback to listening my first ever English music from my favourite band  - "In The End". Thank you @linkinpark  #HybridTheory15
